{
  "schema": "anicel-provenance/v1",
  "id": "urn:anicel:uuid:550e8400-e29b-41d4-a716-446655440000",
  "layer": "cel",
  "production": {
    "production_date": {
      "earliest": 1985,
      "latest": 1990,
      "circa": true,
      "evidence": "TACフィルムの劣化状態および使用塗料の製造時期から推定"
    }
  },
  "condition_assessment": {
    "statement": "良好",
    "assessed_by": "loppo-rokkaho",
    "assessed_at": "2026-03-11"
  },
  "identification_note": "作品タイトル・カット番号 調査中",
  "recorded_by": "loppo-rokkaho",
  "recorded_at": "2026-03-11T05:57:00Z"
}
